{"$schema":"https://json-schema.org/draft/2020-12/schema","$id":"https://distributed-minds.example/signet-adapter-role-contract.v1.schema.json","title":"L2 adapter role contract v1 research fixture","type":"object","additionalProperties":false,"required":["schema","target","integration_mode","operations"],"properties":{"schema":{"const":"signet-adapter-role-contract@1"},"target":{"type":"string","minLength":1},"integration_mode":{"enum":["OPEN_ENGINE","OFFICIAL_MOD","OFFICIAL_API","CONTROLLED_SERVER_GATEWAY","LOCAL_REIMPLEMENTATION"]},"surface_fingerprint":{"type":"string"},"operations":{"type":"array","items":{"type":"object","additionalProperties":false,"required":["id","role","direction","local_mechanism","authority_class","evidence"],"properties":{"id":{"type":"string","pattern":"^[a-z][a-z0-9_.-]+$"},"role":{"enum":["HOST","IMPORTER","WORLD","INPUT","PRESENTATION","AUTHORITY"]},"direction":{"enum":["READ_LOCAL","WRITE_LOCAL","DESCRIBE"]},"local_mechanism":{"type":"string","minLength":1},"semantic_contract_ref":{"type":["string","null"]},"authority_class":{"enum":["INTEGRATION_EVIDENCE","LOCAL_OBSERVATION","SEMANTIC_MAPPING","LOCAL_PRESENTATION","AUTHORITY_CORRECTION"]},"evidence":{"enum":["SOURCE","DOCS","HARNESS","RUNTIME","PROPOSED"]}}}}}}
