{"schema":"signet-adapter-role-contract@1","target":"Godot 4.7.2 GDExtension host boundary","integration_mode":"OPEN_ENGINE","surface_fingerprint":"godot@ed1daf0bf:gdextension-interface@9b55cc98","operations":[{"id":"host.surface_version","role":"HOST","direction":"DESCRIBE","local_mechanism":"GDExtension get_godot_version2","semantic_contract_ref":null,"authority_class":"INTEGRATION_EVIDENCE","evidence":"HARNESS"}]}
